{
  "schema": "perf391-diagnostic-integration-v1",
  "version": 1,
  "role": "C",
  "emitter": "backend",
  "run_id": "fixture",
  "stream_id": "11111111-1111-4111-8111-111111111111-thread-1",
  "seq": 1,
  "process_uuid": "11111111-1111-4111-8111-111111111111",
  "pid": 100,
  "tid": 101,
  "process_start_id": "proc-start-1",
  "thread_start_id": "thread-1",
  "clock_id": "11111111-1111-4111-8111-111111111111-monotonic",
  "mono_ns": "100",
  "thread_cpu_ns": "10",
  "op_id": "tick-1",
  "parent_op_id": null,
  "span_id": "span-1",
  "operation_type": "tick",
  "phase": "collection.enter",
  "outcome": "ok",
  "identity": {},
  "unavailable": {}
}
